{
  "$schema": "../deploy.config.schema.json",
  "kitVersion": "1.0.0",
  "appName": "TodoSample",
  "domains": {
    "web": "example.com",
    "webAliases": [ "www.example.com" ],
    "api": "api.example.com"
  },
  "database": {
    "name": "todosample",
    "role": "todosample",
    "postgres": {
      "majorVersion": 18,
      "installerVersion": "18.6-2",
      "installerSha256": "5DE1182B7F8C823C6BE13D9DE9A5BCA56D1D856AE18E1029AFBD8EF3BA5573D6"
    }
  },
  "downloads": {
    "hostingBundle": {
      "version": "10.0.12",
      "url": "https://builds.dotnet.microsoft.com/dotnet/aspnetcore/Runtime/10.0.12/dotnet-hosting-10.0.12-win.exe",
      "sha512": "ccfb101fc9287e2e10f16e68957a52778463a266d0ea9dc36df1c635ae2396cefba818146d1008f3d8540b90869eaa6fb59bdc4044bd532fe1f30bb26048ad68"
    },
    "urlRewrite": {
      "url": "https://download.microsoft.com/download/1/2/8/128E2E22-C1B9-44A4-BE2A-5859ED1D4592/rewrite_amd64_en-US.msi",
      "sha256": "37342FF2F585F263F34F48E9DE59EB1051D61015A8E967DBDE4075716230A32A"
    },
    "winAcme": {
      "version": "2.2.9.1701",
      "url": "https://github.com/win-acme/win-acme/releases/download/v2.2.9.1701/win-acme.v2.2.9.1701.x64.trimmed.zip",
      "sha256": "F4DC3B144841FFDBA391CE168C273D7A686D45A359075E30EE4BF4EE186857D6"
    }
  },
  "api": {
    "project": "backend/TodoApi/TodoApi.csproj",
    "healthPath": "/api/health",
    "connectionStringKey": "ConnectionStrings__Default",
    "requiredEnvKeys": [ "Cors__AllowedOrigins__0" ]
  },
  "migrations": {
    "enabled": true,
    "context": "TodoDbContext"
  },
  "frontend": {
    "enabled": true,
    "path": "frontend",
    "apiBaseUrlEnvVar": "VITE_API_BASE_URL"
  }
}
